{
  "$schema": "../../../schema/piece.schema.json",
  "$generated": "from catalog/vivo-pro-60x24.json by scripts/generate.mjs (archetype \"standing-desk\"). Edit the spec, not this file.",
  "slug": "vivo-pro-60x24",
  "name": "VIVO PRO",
  "title": "Dual-motor standing desk 60×24\"",
  "brand": "VIVO",
  "brandId": "vivo",
  "disclaimer": "Not affiliated with or endorsed by VIVO.",
  "worksWith": "VIVO® PRO 60×24\" dual-motor electric desk (PRO-DESK-KIT-23B6B), 59×23.6\" top, 25.1–50.7\" height range",
  "productUrl": "https://www.vivo-us.com/products/pro-desk-kit-23b6b",
  "instructionsUrl": "https://cdn.shopify.com/s/files/1/1190/2562/files/PRO-DESKE23B_REV1_online.pdf?v=1788010555",
  "size": [
    150,
    74,
    60
  ],
  "minutes": 45,
  "people": 2,
  "level": 2,
  "color": "#2f2f2f",
  "category": "desks",
  "archetype": "standing-desk",
  "confidence": "medium",
  "sources": [
    "https://www.vivo-us.com/products/pro-desk-kit-23b6b"
  ],
  "parts": [
    {
      "id": "top",
      "label": "Desk top"
    },
    {
      "id": "beam",
      "label": "Crossbeam"
    },
    {
      "id": "bracket",
      "label": "Side bracket"
    },
    {
      "id": "column",
      "label": "Lifting column"
    },
    {
      "id": "foot",
      "label": "Foot"
    },
    {
      "id": "ctrl",
      "label": "Control box"
    },
    {
      "id": "keypad",
      "label": "Keypad"
    },
    {
      "id": "tray",
      "label": "Cable tray"
    }
  ],
  "hardware": [
    {
      "id": "screw",
      "label": "Screw",
      "kind": "screw"
    },
    {
      "id": "bolt",
      "label": "Bolt",
      "kind": "bolt"
    }
  ],
  "objects": [
    {
      "id": "top",
      "part": "top",
      "size": [
        150,
        2.8,
        60
      ],
      "pos": [
        0,
        72.1,
        0
      ]
    },
    {
      "id": "brL",
      "part": "bracket",
      "size": [
        7,
        2.5,
        48
      ],
      "pos": [
        -59.5,
        69.45,
        0
      ]
    },
    {
      "id": "brR",
      "part": "bracket",
      "size": [
        7,
        2.5,
        48
      ],
      "pos": [
        59.5,
        69.45,
        0
      ]
    },
    {
      "id": "beam",
      "part": "beam",
      "size": [
        112,
        5,
        5
      ],
      "pos": [
        0,
        66.7,
        -2
      ]
    },
    {
      "id": "colL",
      "part": "column",
      "size": [
        7,
        64.2,
        5
      ],
      "pos": [
        -59.5,
        36.1,
        -2
      ],
      "boxes": [
        {
          "s": [
            7,
            35.31,
            5
          ],
          "p": [
            0,
            14.45,
            0
          ]
        },
        {
          "s": [
            6,
            32.1,
            4
          ],
          "p": [
            0,
            -16.05,
            0
          ]
        }
      ]
    },
    {
      "id": "colR",
      "part": "column",
      "size": [
        7,
        64.2,
        5
      ],
      "pos": [
        59.5,
        36.1,
        -2
      ],
      "boxes": [
        {
          "s": [
            7,
            35.31,
            5
          ],
          "p": [
            0,
            14.45,
            0
          ]
        },
        {
          "s": [
            6,
            32.1,
            4
          ],
          "p": [
            0,
            -16.05,
            0
          ]
        }
      ]
    },
    {
      "id": "footL",
      "part": "foot",
      "size": [
        7,
        4,
        54
      ],
      "pos": [
        -59.5,
        2,
        0
      ]
    },
    {
      "id": "footR",
      "part": "foot",
      "size": [
        7,
        4,
        54
      ],
      "pos": [
        59.5,
        2,
        0
      ]
    },
    {
      "id": "ctrl",
      "part": "ctrl",
      "size": [
        20,
        4,
        9
      ],
      "pos": [
        0,
        68.7,
        -16
      ]
    },
    {
      "id": "keypad",
      "part": "keypad",
      "size": [
        14,
        2.5,
        6
      ],
      "pos": [
        38,
        69.45,
        27
      ]
    },
    {
      "id": "tray",
      "part": "tray",
      "size": [
        75,
        6,
        8
      ],
      "pos": [
        0,
        67.7,
        -25
      ]
    }
  ],
  "steps": [
    {
      "caption": "Top face down",
      "say": "Lay the desk top upside down on the flattened box or a rug, so the good side stays scratch-free.",
      "add": [
        "top"
      ],
      "from": [
        0,
        30,
        0
      ],
      "pose": [
        180,
        0,
        0
      ],
      "view": {
        "az": 30,
        "el": 50
      }
    },
    {
      "caption": "Crossbeam + brackets",
      "say": "Slide the side brackets onto the ends of the crossbeam, set it in the middle of the top, and stretch it out until the brackets sit near the ends. Screw both brackets into the top.",
      "add": [
        "beam",
        "brL",
        "brR"
      ],
      "from": [
        0,
        -25,
        0
      ],
      "hardware": [
        {
          "id": "screw",
          "axis": "-y",
          "at": [
            [
              -59.5,
              70.7,
              16
            ],
            [
              -59.5,
              70.7,
              -16
            ],
            [
              59.5,
              70.7,
              16
            ],
            [
              59.5,
              70.7,
              -16
            ]
          ],
          "spin": true
        },
        {
          "id": "screw",
          "axis": "+y",
          "count": 4
        }
      ],
      "view": {
        "az": 30,
        "el": 55
      }
    },
    {
      "caption": "2 lifting columns",
      "say": "Set each lifting column onto its bracket, motor end against the beam, and bolt it down. Cables face the back.",
      "add": [
        "colL",
        "colR"
      ],
      "from": [
        0,
        -40,
        0
      ],
      "hardware": [
        {
          "id": "bolt",
          "axis": "+y",
          "count": 8
        }
      ],
      "view": {
        "az": 35,
        "el": 40
      },
      "safety": "Columns are heavy. Lift with your legs."
    },
    {
      "caption": "2 feet",
      "say": "Bolt a foot across the end of each column, longer side toward the front. Check both feet point the same way.",
      "add": [
        "footL",
        "footR"
      ],
      "from": [
        0,
        -30,
        0
      ],
      "hardware": [
        {
          "id": "bolt",
          "axis": "+y",
          "count": 8
        }
      ],
      "view": {
        "az": 30,
        "el": 35
      }
    },
    {
      "caption": "Control box + keypad",
      "say": "Screw the control box under the top near the back, and the keypad under the front edge on the side you prefer.",
      "add": [
        "ctrl",
        "keypad"
      ],
      "from": [
        0,
        -20,
        0
      ],
      "hardware": [
        {
          "id": "screw",
          "axis": "+y",
          "count": 6
        }
      ],
      "view": {
        "az": 20,
        "el": 60
      }
    },
    {
      "caption": "Plug in the cables",
      "say": "Plug both motor cables and the keypad cable into the control box, then tuck everything into the cable tray and screw the tray on. Do not plug into the wall yet.",
      "add": [
        "tray"
      ],
      "from": [
        0,
        -20,
        0
      ],
      "hardware": [
        {
          "id": "screw",
          "axis": "+y",
          "count": 4
        }
      ],
      "view": {
        "az": 160,
        "el": 50
      }
    },
    {
      "caption": "Flip it over",
      "say": "With a helper, lift the desk and turn it onto its feet. Lift it clear, do not pivot it on one leg.",
      "pose": [
        360,
        0,
        0
      ],
      "view": {
        "az": 30,
        "el": 20
      },
      "safety": "Two-person lift."
    },
    {
      "caption": "Power on + reset",
      "say": "Plug it in, then run the first-time reset from your manual, usually holding the down button until the desk bottoms out. Test up and down with nothing on top.",
      "view": {
        "az": 25,
        "el": 15
      }
    }
  ],
  "done": "Done. Your VIVO PRO dual-motor standing desk 60×24\" is built. Give it a proud little pat.",
  "notes": "Brand page: 59×23.6×1.1\" top, 25.1 to 50.7\" height range, 330 lb frame capacity, separate frame and top manuals. Shown at sitting height."
}
