{
  "$schema": "../../../schema/piece.schema.json",
  "$generated": "from catalog/ecr4kids-sleekline-cubby-3x4.json by scripts/generate.mjs (archetype \"cubby\"). Edit the spec, not this file.",
  "slug": "ecr4kids-sleekline-cubby-3x4",
  "name": "SLEEKLINE",
  "title": "12-cubby storage 3×4",
  "brand": "ECR4Kids",
  "brandId": "ecr4kids",
  "disclaimer": "Not affiliated with or endorsed by ECR4Kids.",
  "worksWith": "ECR4Kids® Sleekline 12-Compartment Cubby Storage Cabinet 3x4, 37.12×13×20.1\" (W×D×H)",
  "productUrl": "https://ecr4kids.com/products/sleekline-12-compartment-cubby-storage-cabinet-3x4",
  "instructionsUrl": "https://images.salsify.com/image/upload/s--NE1m_lhp--/iepvd82a5u5qxlt6bc4r.pdf",
  "size": [
    94,
    51,
    33
  ],
  "minutes": 35,
  "people": 1,
  "level": 2,
  "color": "#e8d3b0",
  "category": "kids",
  "archetype": "cubby",
  "confidence": "low",
  "sources": [
    "https://ecr4kids.com/products/sleekline-12-compartment-cubby-storage-cabinet-3x4"
  ],
  "parts": [
    {
      "id": "side",
      "label": "Side panel"
    },
    {
      "id": "end",
      "label": "Top and bottom"
    },
    {
      "id": "long",
      "label": "Long shelf",
      "plural": "Long shelves"
    },
    {
      "id": "div",
      "label": "Divider"
    }
  ],
  "hardware": [
    {
      "id": "screw",
      "label": "Screw",
      "kind": "screw"
    },
    {
      "id": "dowel",
      "label": "Wood dowel",
      "kind": "dowel"
    }
  ],
  "objects": [
    {
      "id": "sideL",
      "part": "side",
      "size": [
        1.6,
        51.1,
        33
      ],
      "pos": [
        -46.35,
        25.55,
        0
      ]
    },
    {
      "id": "sideR",
      "part": "side",
      "size": [
        1.6,
        51.1,
        33
      ],
      "pos": [
        46.35,
        25.55,
        0
      ]
    },
    {
      "id": "bottom",
      "part": "end",
      "size": [
        91.1,
        1.6,
        33
      ],
      "pos": [
        0,
        0.8,
        0
      ]
    },
    {
      "id": "top",
      "part": "end",
      "size": [
        91.1,
        1.6,
        33
      ],
      "pos": [
        0,
        50.3,
        0
      ]
    },
    {
      "id": "long1",
      "part": "long",
      "size": [
        91.1,
        1.6,
        33
      ],
      "pos": [
        0,
        17.3,
        0
      ]
    },
    {
      "id": "long2",
      "part": "long",
      "size": [
        91.1,
        1.6,
        33
      ],
      "pos": [
        0,
        33.8,
        0
      ]
    },
    {
      "id": "div1_1",
      "part": "div",
      "size": [
        1.6,
        14.9,
        32.5
      ],
      "pos": [
        -23.17,
        9.05,
        0.25
      ]
    },
    {
      "id": "div1_2",
      "part": "div",
      "size": [
        1.6,
        14.9,
        32.5
      ],
      "pos": [
        0,
        9.05,
        0.25
      ]
    },
    {
      "id": "div1_3",
      "part": "div",
      "size": [
        1.6,
        14.9,
        32.5
      ],
      "pos": [
        23.17,
        9.05,
        0.25
      ]
    },
    {
      "id": "div2_1",
      "part": "div",
      "size": [
        1.6,
        14.9,
        32.5
      ],
      "pos": [
        -23.17,
        25.55,
        0.25
      ]
    },
    {
      "id": "div2_2",
      "part": "div",
      "size": [
        1.6,
        14.9,
        32.5
      ],
      "pos": [
        0,
        25.55,
        0.25
      ]
    },
    {
      "id": "div2_3",
      "part": "div",
      "size": [
        1.6,
        14.9,
        32.5
      ],
      "pos": [
        23.17,
        25.55,
        0.25
      ]
    },
    {
      "id": "div3_1",
      "part": "div",
      "size": [
        1.6,
        14.9,
        32.5
      ],
      "pos": [
        -23.17,
        42.05,
        0.25
      ]
    },
    {
      "id": "div3_2",
      "part": "div",
      "size": [
        1.6,
        14.9,
        32.5
      ],
      "pos": [
        0,
        42.05,
        0.25
      ]
    },
    {
      "id": "div3_3",
      "part": "div",
      "size": [
        1.6,
        14.9,
        32.5
      ],
      "pos": [
        23.17,
        42.05,
        0.25
      ]
    }
  ],
  "steps": [
    {
      "caption": "Side + bottom",
      "say": "Stand one side panel on its edge, holes facing in. Butt the bottom board against it and drive two screws through the side into the board. Stop when the head is flush.",
      "add": [
        "sideL",
        "bottom"
      ],
      "from": [
        -30,
        0,
        0
      ],
      "hardware": [
        {
          "id": "screw",
          "axis": "+x",
          "at": [
            [
              -45.55,
              0.8,
              13.5
            ],
            [
              -45.55,
              0.8,
              -13.5
            ]
          ],
          "spin": true
        }
      ],
      "view": {
        "az": 45,
        "el": 25
      }
    },
    {
      "caption": "2 long shelves",
      "say": "Screw the two long shelves to the same side, two screws each. The holes set the cubby height, so just follow them.",
      "add": [
        "long1",
        "long2"
      ],
      "from": [
        35,
        0,
        0
      ],
      "hardware": [
        {
          "id": "screw",
          "axis": "+x",
          "at": [
            [
              -45.55,
              17.3,
              13.5
            ],
            [
              -45.55,
              17.3,
              -13.5
            ],
            [
              -45.55,
              33.8,
              13.5
            ],
            [
              -45.55,
              33.8,
              -13.5
            ]
          ],
          "spin": true
        }
      ],
      "view": {
        "az": 40,
        "el": 30
      }
    },
    {
      "caption": "Dividers (9)",
      "say": "Tap a dowel into each divider hole, then press the nine short dividers in between the boards, three per row. Push each one fully home so the cubbies stay square.",
      "add": [
        "div1_1",
        "div1_2",
        "div1_3",
        "div2_1",
        "div2_2",
        "div2_3",
        "div3_1",
        "div3_2",
        "div3_3"
      ],
      "from": [
        0,
        0,
        30
      ],
      "hardware": [
        {
          "id": "dowel",
          "axis": "+y",
          "at": [
            [
              -23.17,
              1.6,
              0
            ],
            [
              0,
              1.6,
              0
            ],
            [
              23.17,
              1.6,
              0
            ],
            [
              -23.17,
              18.1,
              0
            ],
            [
              0,
              18.1,
              0
            ],
            [
              23.17,
              18.1,
              0
            ],
            [
              -23.17,
              34.6,
              0
            ],
            [
              0,
              34.6,
              0
            ],
            [
              23.17,
              34.6,
              0
            ]
          ]
        }
      ],
      "view": {
        "az": 25,
        "el": 30
      }
    },
    {
      "caption": "Top on",
      "say": "Set the top board over the last row of dividers and screw it to the side panel.",
      "add": [
        "top"
      ],
      "from": [
        0,
        30,
        0
      ],
      "hardware": [
        {
          "id": "screw",
          "axis": "+x",
          "at": [
            [
              -45.55,
              50.3,
              13.5
            ],
            [
              -45.55,
              50.3,
              -13.5
            ]
          ],
          "spin": true
        }
      ],
      "view": {
        "az": 30,
        "el": 40
      }
    },
    {
      "caption": "Second side",
      "say": "line the second side up with every board end and screw it on, top to bottom. Then check each cubby is square before the screws bite.",
      "add": [
        "sideR"
      ],
      "from": [
        35,
        0,
        0
      ],
      "hardware": [
        {
          "id": "screw",
          "axis": "-x",
          "at": [
            [
              45.55,
              0.8,
              13.5
            ],
            [
              45.55,
              0.8,
              -13.5
            ],
            [
              45.55,
              17.3,
              13.5
            ],
            [
              45.55,
              17.3,
              -13.5
            ],
            [
              45.55,
              33.8,
              13.5
            ],
            [
              45.55,
              33.8,
              -13.5
            ],
            [
              45.55,
              50.3,
              13.5
            ],
            [
              45.55,
              50.3,
              -13.5
            ]
          ],
          "spin": true
        }
      ],
      "view": {
        "az": -40,
        "el": 25
      }
    },
    {
      "caption": "Wobble test",
      "say": "Set it on a flat floor and press on each top corner. If it rocks, check the screws again. Fill the low cubbies with the heavy things.",
      "view": {
        "az": 25,
        "el": 20
      }
    }
  ],
  "done": "Done. Your SLEEKLINE 12-cubby storage 3×4 is built. Give it a proud little pat.",
  "notes": "Brand page: 37.12\" W × 13\" D × 20.1\" H, 12 cubbies each 8.5\" W × 11.5\" D × 6\" H, adult assembly. Board thickness (5/8\") is worked out from those numbers; screw-and-dowel joinery is our best guess."
}
